{
  "version": "paper-result/2.0",
  "run_id": "23a7633b-ef0c-4733-9521-3068ead8f15a",
  "case_id": "test-person-05-none",
  "condition": "C_verified_rag",
  "seed": 42,
  "status": "success",
  "finish_reason": "eos",
  "answer": "1. 구현: Python으로 대기질 관측 프로젝트에서 일별 오염도 기능을 구현한 총 8개의 기능.\n2. 점검: 대기질 관측 프로젝트에서 작성한 결측치 점검 사례의 총 12건.\n3. 교육: 대기질 관측 실습 과정에서 28시간의 총 이수 시간.\n\n해당 record_id: d6c68575-4d1e-5153-a025-08b7132328a8\n\n미확인: JD 요구 중 확인되지 않은 사항: \"데이터 정제, 집계, 분석 결과 설명을 요구하는 주니어 데이터 분석 직무.\"\n\n향후 학습: 향후 학습 제안: Python 기술을 더욱深化하기 위해 공부할 필요가 있다.",
  "context_record_ids": [
    "d6c68575-4d1e-5153-a025-08b7132328a8",
    "6f1e309b-0a7f-59c4-971f-2a71fcb1fa24",
    "c2d90582-cd70-507b-ab0c-3ff3c792a90a",
    "741b131e-ac7a-55f0-9c4c-cd49f1ea6cf0"
  ],
  "input_tokens": 1329,
  "output_tokens": 212
}
