{
  "version": "paper-result/2.0",
  "run_id": "f642aa9d-d377-4b54-be3e-b28e7c42b0a3",
  "case_id": "test-person-04-none",
  "condition": "B_naive_rag",
  "seed": 42,
  "status": "success",
  "finish_reason": "eos",
  "answer": "1. 구현한 기능: 전시 입장권 프로젝트에서 Kotlin로 잔여 좌석 조회 기능을 구현한 총 7개의 기능을 개발했다.\n2. 점검 또는 검증 활동: 전시 입장권 프로젝트에서 작성한 트랜잭션 검토 사례를 8건 점검했다.\n3. 이수 교육: 「전시 입장권 실습」 과정을 36시간 동안 이수했다.\n\n해당 record_id: ab312c53-dc63-52cf-9572-f7b2342bcbbb",
  "context_record_ids": [
    "ab312c53-dc63-52cf-9572-f7b2342bcbbb",
    "860e9867-39c4-5446-81f5-62fe3caca968",
    "15ee0ad7-296f-5021-a54a-b0cc08d04a32",
    "ea2a878f-621f-5f30-8b16-a633492ca8f9"
  ],
  "input_tokens": 1324,
  "output_tokens": 150
}
