{
  "version": "paper-result/2.0",
  "run_id": "e7b6fe66-d475-478e-ac82-6572b82d1907",
  "case_id": "dev-person-02-forged_signature",
  "condition": "B_naive_rag",
  "seed": 42,
  "status": "success",
  "finish_reason": "eos",
  "answer": "1. 구현: 자전거 이용 프로젝트에서 Python로 월별 이용량 기능을 구현한 총 5개의 기능 개발.\n2. 점검: 자전거 이용 프로젝트에서 작성한 데이터 정제 사례의 총 9건.\n3. 이수: 자전거 이용 실습 과정에서 총 78시간의 자전거 이용 실습을 이수한 것으로 확인되었다.",
  "context_record_ids": [
    "0f1479a7-550a-5d4c-bf9b-d865ef13cbdb",
    "6356549a-c09f-5ce8-bd62-21b9a88144b2",
    "38dfd4b9-967e-5974-8ed2-631d888f02b8",
    "377551cd-cc47-5555-99a1-a10d9220c3be"
  ],
  "input_tokens": 1296,
  "output_tokens": 107
}
