{
  "version": "paper-result/2.0",
  "run_id": "ee6ced7b-5775-41ef-8aea-388f0611c54e",
  "case_id": "test-person-08-untrusted_issuer",
  "condition": "B_naive_rag",
  "seed": 42,
  "status": "success",
  "finish_reason": "eos",
  "answer": "1. 구현: Python으로 요일별 사용량 기능을 5개 개발했으며, 이 기능은 데이터 정제, 집계, 분석 결과 설명에 활용되었습니다.\n2. 점검: 10건 이상의 이상값 표시 사례를 작성했으며, 이는 데이터 정제, 집계, 분석 결과 설명에 필요한 검증 활동을 수행하였습니다.\n3. 교육: 「건물 전력 실습」 과정을 32시간 이수하였으며, 이는 데이터 정제, 집계, 분석 결과 설명에 필요한 교육 활동을 수행하였습니다.\n4. 확인 불가: JD 요구 중 확인되지 않은 사항은 없습니다.\n5. 향후 학습: Python 기반의 데이터 분석 및 처리 기술을 습득하여 데이터 정제, 집계, 분석 결과 설명을 위한 기능을 개발하고, 이상값을 검증하는 검증 활동을 수행할 수 있는 능력을 향후 학습할 것입니다.",
  "context_record_ids": [
    "d82db11e-42f9-583e-80af-01e5e4e22096",
    "39ac354e-a0c4-5772-9965-a70c82e4b9c3",
    "9080e5f2-0b9d-561b-9722-cc3a3a7e086a",
    "832f32df-3a95-52f0-9c67-2509e88eeee7"
  ],
  "input_tokens": 1321,
  "output_tokens": 229
}
