{
  "version": "paper-result/2.0",
  "run_id": "e86c536c-5d68-4a91-ade4-58aff8e90dd1",
  "case_id": "dev-person-02-revoked",
  "condition": "C_verified_rag",
  "seed": 42,
  "status": "success",
  "finish_reason": "eos",
  "answer": "1. 구현: 자전거 이용 점검 기록 9건, 자전거 이용 구현 기록 5건\n2. 점검: 자전거 이용 점검 기록 9건, 자전거 이용 구현 기록 5건\n3. 이수: 자전거 이용 점검 기록 9건, 자전거 이용 구현 기록 5건\n4. 확인 불가: 자전거 이용 점검 기록 9건, 자전거 이용 구현 기록 5건\n5. 향후 학습: 자전거 이용 점검 기록 9건, 자전거 이용 구현 기록 5건",
  "context_record_ids": [
    "34af6393-fb08-5fe7-a01d-114d04a73199",
    "ba0bbac3-c3f5-5277-b77f-4f656ad87aff"
  ],
  "input_tokens": 913,
  "output_tokens": 157
}
